{
  "status": "ok",
  "server_time": "2026-09-04T15:20:00Z",
  "sim_time": "2026-09-04T15:20:00Z",
  "cycle_number": 160,
  "modules": {
    "forecaster": {
      "ready": true,
      "active_source": "twin_model"
    },
    "cascade": {
      "ready": true,
      "active_source": "deterministic"
    },
    "twin": {
      "ready": true,
      "ensemble_size": 20
    },
    "equilibrium": {
      "ready": true
    },
    "commander": {
      "ready": true,
      "active_source": "deterministic"
    }
  }
}
